
Recipe_ID,Name,Preparation_Instructions,Serving_Size,Timestamp_Created
1,Teriyaki Salmon,Marinate salmon in a mixture of soy sauce, mirin, and honey for 30 minutes. Grill salmon until cooked through. Serve with steamed vegetables.,2,2019-03-01
2,Miso Soup,In a pot, bring 4 cups of water to a boil. Add 1 tablespoon of miso paste and stir until dissolved. Add 1 cup of diced tofu and simmer for 10 minutes. Serve with scallions.,4,2019-03-05
3,Mushroom Risotto,Heat 2 tablespoons of olive oil in a large pot over medium heat. Add 1 cup of diced mushrooms and sauté for 5 minutes. Add 1 cup of arborio rice and stir to coat. Add 2 cups of vegetable broth and bring to a boil. Reduce heat and simmer for 15 minutes. Stir in 1/4 cup of parmesan cheese and serve.,4,2019-04-01
4,Kimchi Fried Rice,Heat 2 tablespoons of sesame oil in a large skillet over medium heat. Add 1 cup of kimchi and sauté for 5 minutes. Add 2 cups of cooked white rice and stir to combine. Add 2 tablespoons of soy sauce and 1 teaspoon of sugar. Cook for an additional 5 minutes and serve.,4,2019-04-05
5,Tofu and Eggplant Stir-Fry,Heat 2 tablespoons of vegetable oil in a large skillet over medium heat. Add 1 cup of diced eggplant and sauté for 5 minutes. Add 1 cup of diced tofu and stir to combine. Add 1/4 cup of soy sauce and 1 teaspoon of sugar. Cook for an additional 5 minutes and serve.,4,2019-05-01
6,Unagi Donburi,Marinate unagi in a mixture of soy sauce, mirin, and honey for 30 minutes. Grill unagi until cooked through. Place unagi on top of a bowl of steamed white rice. Drizzle with additional soy sauce and serve.,2,2019-05-05
7,Vegetable Tempura,In a bowl, combine 1 cup of all-purpose flour, 1 teaspoon of baking powder, and 1/2 cup of cold water. Heat 2 cups of vegetable oil in a large pot over medium heat. Dip vegetables in the tempura batter and fry until golden brown. Serve with soy sauce and grated ginger.,4,2019-06-01
8,Udon Noodle Soup,In a large pot, bring 8 cups of water to a boil. Add 1 teaspoon of dashi powder and stir to dissolve. Add 1 package of udon noodles and simmer for 8 minutes. Add 1 cup of diced vegetables and simmer for an additional 5 minutes. Serve with scallions and shichimi togarashi.,4,2019-06-05
9,Miso Glazed Eggplant,Heat 2 tablespoons of sesame oil in a large skillet over medium heat. Add 1 cup of diced eggplant and sauté for 5 minutes. Add 1/4 cup of miso paste and 1 teaspoon of sugar. Simmer for an additional 5 minutes and serve.,4,2019-07-01
10,Grilled Shishito Peppers,Heat a grill over medium-high heat. Place 1/2 pound of shishito peppers on the grill and cook for 5 minutes, turning occasionally. Place peppers in a bowl and drizzle with a mixture of soy sauce, mirin, and honey. Serve with grated ginger.,2,2019-07-05
11,Miso Marinated Cod,Marinate cod in a mixture of miso paste, sake, and honey for 30 minutes. Grill cod until cooked through. Serve with steamed vegetables.,2,2019-08-01
12,Takoyaki,In a bowl, combine 1 cup of all-purpose flour, 1 teaspoon of baking powder, 1/2 teaspoon of dashi powder, and 1/2 cup of cold water. Heat 1/2 cup of vegetable oil in a large pan over medium heat. Drop 1 tablespoon of batter into the pan and add 1 tablespoon of diced octopus. Fry until golden brown. Serve with takoyaki sauce and mayonnaise.,4,2019-08-05
13,Edamame,Bring a pot of water to a boil. Add 1 cup of edamame and cook for 5 minutes. Drain and season with a mixture of soy sauce, mirin, and sesame oil. Serve.,4,2019-09-01
14,Miso Glazed Eggplant,Heat 2 tablespoons of sesame oil in a large skillet over medium heat. Add 1 cup of diced eggplant and sauté for 5 minutes. Add 1/4 cup of miso paste and 1 teaspoon of sugar. Simmer for an additional 5 minutes and serve.,4,2019-09-05
15,Grilled Shishito Peppers,Heat a grill over medium-high heat. Place 1/2 pound of shishito peppers on the grill and cook for 5 minutes, turning occasionally. Place peppers in a bowl and drizzle with a mixture of soy sauce, mirin, and honey. Serve with grated ginger.,2,2019-10-01
16,Teriyaki Chicken,Marinate chicken in a mixture of soy sauce, mirin, and honey for 30 minutes. Grill chicken until cooked through. Serve with steamed vegetables.,2,2019-10-05
17,Miso Ramen,In a pot, bring 4 cups of water to a boil. Add 1 tablespoon of miso paste and stir until dissolved. Add 1 package of ramen noodles and cook for 5 minutes. Add 1 cup of diced vegetables and simmer for an additional 5 minutes. Serve with scallions and shichimi togarashi.,4,2019-11-01
18,Miso Glazed Salmon,Marinate salmon in a mixture of miso paste, sake, and honey for 30 minutes. Grill salmon until cooked through. Serve with steamed vegetables.,2,2019-11-05
19,Umeboshi Onigiri,In a bowl, combine 1 cup of cooked white rice, 1 tablespoon of umeboshi paste, and 1 teaspoon of sesame oil. Form into 3 triangular shaped onigiri. Wrap in nori and serve.,3,2019-12-01
20,Miso Soup,In a pot, bring 4 cups of water to a boil. Add 1 tablespoon of miso paste and stir until dissolved. Add 1 cup of diced tofu and simmer for 10 minutes. Serve with scallions.,4,2019-12-05